{
  "sobjects" : "/services/data/v26.0/sobjects" ,
  "licensing" : "/services/data/v26.0/licensing" ,
  "connect" : "/services/data/v26.0/connect" ,
  "search" : "/services/data/v26.0/search" ,
  "query" : "/services/data/v26.0/query" ,
  "tooling" : "/services/data/v26.0/tooling" ,
  "chatter" : "/services/data/v26.0/chatter" ,
  "recent" : "/services/data/v26.0/recent"
}